http://resource.geosciml.org/classifier/cgi/lithology/tholeiitic_basalt,"tholeiitic basalt","Tholeiitic basalt is defined here to contain 2 pyroxene phases and interstitial quartz or tridymite or cristobalite in the groundmass. Pyroxene (augite and orthopyroxene or pigeonite) and calcium-rich plagioclase are common phenocryst minerals. Olivine may also be a phenocryst, and when present, may have rims of pigeonite. Only in tholeiitic basalt is olivine in reaction relationship with melt. Interstitial siliceous residue may be present, and is often glassy. Tholeiitic basalt is relatively poor in sodium.   This category includes most basalts of the ocean floor, most large oceanic islands, and continental flood basalts such as the Columbia River Plateau."
http://resource.geosciml.org/classifier/cgi/lithology/tonalite,tonalite,"Granitoid consisting of quartz and intermediate plagioclase, usually with biotite and amphibole. Includes rocks defined modally in QAPF field 5; ratio of plagioclase to total feldspar is greater than 0.9."
http://resource.geosciml.org/classifier/cgi/lithology/trachyte,trachyte,"Trachytoid that has a plagioclase to total feldspar ratio between 0.1 and 0.35,  between 0 and 5 percent quartz in the QAPF fraction, and no feldspathoid minerals. QAPF field 7."
http://resource.geosciml.org/classifier/cgi/lithology/trachytic_rock,"trachytic rock","Trachytoid that has a plagioclase to total feldspar ratio between 0.1 and 0.35. QAPF fields 7, 7', and 7*."
http://resource.geosciml.org/classifier/cgi/lithology/trachytoid,trachytoid,"Fine grained igneous rock than contains less than 90 percent mafic minerals, less than 10 percent feldspathoid mineral and less than 20 percent quartz in the QAPF fraction and has a plagioclase to total feldspar ratio less than 0.65.   Mafic minerals typically include amphibole or mica; typically porphyritic. Includes rocks defined modally in QAPF fields 6, 7 and 8 (with subdivisions) or chemically in TAS Field T as trachyte or latite."
http://resource.geosciml.org/classifier/cgi/lithology/travertine,travertine,"Biotically or abiotically precipitated calcium carbonate, from spring-fed, heated, or ambient-temperature water. May be white and spongy, various shades of orange, tan or gray, and ranges to dense, banded or laminated rock. Macrophytes, bryophytes, algae, cyanobacteria and other organisms often colonize the surface of travertine and may be preserved, to produce the porous varieties."
http://resource.geosciml.org/classifier/cgi/lithology/tuff_breccia_agglomerate_or_pyroclastic_breccia,"tuff breccia agglomerate or pyroclastic breccia","Pyroclastic rock in which greater than 25 percent of particles are greater than 64 mm in largest dimension. Includes agglomerate, pyroclastic breccia of Gillespie and Styles (1999)"
http://resource.geosciml.org/classifier/cgi/lithology/tuffite,Tuffit,"Rock consists of more than 50 percent particles of indeterminate pyroclastic or epiclastic origin and less than 75 percent particles of clearly pyroclastic origin. commonly the rock is laminated or exhibits size grading. (based on LeMaitre et al. 2002; Murawski and Meyer 1998)."
http://resource.geosciml.org/classifier/cgi/lithology/ultrabasic_igneous_rock,"ultrabasic igneous rock","Igneous rock with less than 45 percent SiO2."
http://resource.geosciml.org/classifier/cgi/lithology/ultramafic_igneous_rock,"ultramafic igneous rock","Igneous rock that consists of greater than 90 percent mafic minerals."
http://resource.geosciml.org/classifier/cgi/lithology/unconsolidated_material,"unconsolidated material","compoundMaterial composed of an aggregation of particles that do not adhere to each other strongly enough that the aggregate can be considered a solid in its own right."
http://resource.geosciml.org/classifier/cgi/lithology/wacke,wacke,"Clastic sandstone with more than 10 percent matrix of indeterminate detrital or diagenetic nature. Matrix is mud size silicate minerals (clay, feldspar, quartz, rock fragments, and alteration products)."
http://resource.geosciml.org/classifierscheme/cgi/201211/simplelithology,"CGI Simple Lithology Categories","This is the  201202 CGI Simple Lithology vocabulary. Minor comment and bug fixes to definitions and encoding are made in this version. Major change is conversion of URIs to http URI."
